{
  "required" : true ,
  "$schema" : "http://json-schema.org/draft-03/schema" ,
  "type" : "object" ,
  "properties" : {
    "fullImageUrl" : {
      "type" : "string" ,
      "required" : false
    } ,
    "size" : {
      "type" : "object" ,
      "required" : false
    } ,
    "thumbnailUrl" : {
      "type" : "string" ,
      "required" : false
    } ,
    "name" : {
      "type" : "string" ,
      "required" : false
    } ,
    "description" : {
      "type" : "string" ,
      "required" : false
    } ,
    "permissions" : {
      "type" : "string" ,
      "required" : false
    } ,
    "folderId" : {
      "type" : "string" ,
      "required" : false
    } ,
    "sourceTemplateId" : {
      "type" : "string" ,
      "required" : false
    } ,
    "createdBy" : {
      "type" : "string" ,
      "required" : false
    } ,
    "createdAt" : {
      "type" : "string" ,
      "required" : false
    } ,
    "updatedBy" : {
      "type" : "string" ,
      "required" : false
    } ,
    "updatedAt" : {
      "type" : "string" ,
      "required" : false
    } ,
    "accessedAt" : {
      "type" : "string" ,
      "required" : false
    } ,
    "scheduledFor" : {
      "type" : "string" ,
      "required" : false
    } ,
    "depth" : {
      "type" : "string" ,
      "required" : false
    }
  }
}